{
	"annotationTrace": [
		{
			"action": "begin_interaction",
			"details": {
				"repoName": "tldraw",
				"problemStatement": "TldrawEditor cannot be used standalone without TldrawUiContextProvider. NoteShapeUtil has hard dependency on TldrawUiContextProvider causing crashes when used standalone.",
				"userPrompt": "I've received a bug report that TldrawEditor cannot be used standalone without TldrawUiContextProvider.\n\n**Problem**:\nUsers who want to use `TldrawEditor` by itself cannot use some tldraw shapes because they have a hard dependency on `TldrawUiContextProvider` being present in the React tree. This bloats bundle size unnecessarily if users don't need all the UI functionality.\n\nSpecifically, the `NoteShapeUtil` is trying to use RTL (right-to-left) text direction detection and relies on `useCurrentTranslation()` which expects `TldrawUiContextProvider` to be present. When it's not present, the app crashes.\n\n**Implementation Details**:\n\nFor the NoteShapeUtil changes:\n- Change from `useCurrentTranslation()` to `useContext(TranslationsContext)`\n- Use optional chaining when accessing translation.dir: `translation?.dir`\n- Update the dependency array to use `translation?.dir` instead of `translation.dir`"
			},
			"thought": "I need to understand the structure of the tldraw codebase to locate the NoteShapeUtil and the translation context. First, I'll search for files related to NoteShapeUtil and the translation hooks to understand the current implementation and identify what needs to be changed.",
			"timestamp": "2025-12-01T18:25:50.078Z",
			"elapsed_seconds": 25,
			"duration_seconds": 0,
			"partition": "EnvironmentSetup"
		},
		{
			"action": "search_string",
			"details": {
				"path": ".",
				"searchKey": "NoteShapeUtil",
				"results": [
					"packages/tldraw/src/index.ts:155",
					"packages/tldraw/src/lib/defaultShapeUtils.ts:10",
					"packages/tldraw/src/lib/shapes/note/NoteShapeUtil.tsx:70",
					"apps/examples/src/examples/resize-note/ResizeNoteExample.tsx:1",
					"apps/examples/src/examples/configure-shape-util/ConfigureShapeUtilExample.tsx:1",
					"packages/tldraw/src/test/resizing.test.ts:19"
				]
			},
			"thought": "I found the NoteShapeUtil implementation at packages/tldraw/src/lib/shapes/note/NoteShapeUtil.tsx. Now I need to search for the useCurrentTranslation hook to understand how it's currently being used and where the TranslationsContext is defined.",
			"timestamp": "2025-12-01T18:27:05.146Z",
			"elapsed_seconds": 100,
			"duration_seconds": 0,
			"partition": "EnvironmentSetup"
		},
		{
			"action": "search_string",
			"details": {
				"path": ".",
				"searchKey": "useCurrentTranslation",
				"results": [
					"packages/tldraw/src/index.ts:658",
					"packages/tldraw/src/lib/ui/hooks/useTranslation/useTranslation.tsx:29",
					"packages/tldraw/src/lib/shapes/note/NoteShapeUtil.tsx:36"
				]
			},
			"thought": "I found that useCurrentTranslation is defined in packages/tldraw/src/lib/ui/hooks/useTranslation/useTranslation.tsx and it throws an error when TranslationsContext is not available. The NoteShapeUtil uses this hook at line 496. Now I need to read both files to understand the current implementation and make the necessary changes.",
			"timestamp": "2025-12-01T18:27:15.644Z",
			"elapsed_seconds": 110,
			"duration_seconds": 0,
			"partition": "EnvironmentSetup"
		},
		{
			"action": "open_file",
			"details": {
				"file": "packages/tldraw/src/lib/ui/hooks/useTranslation/useTranslation.tsx"
			},
			"thought": "I've read the useTranslation hook file and the NoteShapeUtil file. I can see that TranslationsContext is defined at line 26 in useTranslation.tsx, and useCurrentTranslation throws an error when the context is null. The NoteShapeUtil uses useCurrentTranslation at line 496 and accesses translation.dir at line 515 and 543. I need to export TranslationsContext and modify NoteShapeUtil to use useContext directly with optional chaining. I'll also need to check for the vitest setup file to add the CSS.supports polyfill.",
			"timestamp": "2025-12-01T18:27:31.247Z",
			"elapsed_seconds": 126,
			"duration_seconds": 0,
			"partition": "EnvironmentSetup"
		},
		{
			"action": "search_string",
			"details": {
				"path": "internal/config",
				"searchKey": "vitest.*setup",
				"results": ["internal/config/vitest/setup.ts"]
			},
			"thought": "I found the vitest setup file at internal/config/vitest/setup.ts. Now I need to read this file to understand its current structure and add the CSS.supports polyfill. Let me read both the vitest setup file and check the index.ts file to see what's currently exported from the tldraw package.",
			"timestamp": "2025-12-01T18:27:55.122Z",
			"elapsed_seconds": 150,
			"duration_seconds": 0,
			"partition": "EnvironmentSetup"
		},
		{
			"action": "open_file",
			"details": {
				"file": "internal/config/vitest/setup.ts"
			},
			"thought": "I've read the vitest setup file and the tldraw index.ts. Now I have a clear understanding of what needs to be done. I need to: 1) Export TranslationsContext from useTranslation.tsx with @internal annotation, 2) Modify NoteShapeUtil to use useContext directly with optional chaining instead of useCurrentTranslation, 3) Add CSS.supports polyfill to the vitest setup file. Let me start by modifying the useTranslation.tsx file to export TranslationsContext.",
			"timestamp": "2025-12-01T18:28:22.828Z",
			"elapsed_seconds": 178,
			"duration_seconds": 0,
			"partition": "Solution"
		},
		{
			"action": "add_thought",
			"details": {},
			"thought": "Now I'll modify the useTranslation.tsx file to export TranslationsContext with an @internal JSDoc annotation. This will allow NoteShapeUtil to access the context directly while marking it as not intended for public use. I'll use apply_diff to make this surgical change to the file.",
			"timestamp": "2025-12-01T18:28:31.042Z",
			"elapsed_seconds": 186,
			"duration_seconds": 0,
			"partition": "Solution"
		},
		{
			"action": "find_and_replace_code",
			"details": {
				"file": "packages/tldraw/src/lib/ui/hooks/useTranslation/useTranslation.tsx",
				"changes": [
					{
						"originalText": {
							"startLine": 23,
							"endLine": 26,
							"context": "/** @public */\nexport type TLUiTranslationContextType = TLUiTranslation\n\nconst TranslationsContext = React.createContext<TLUiTranslationContextType | null>(null)"
						},
						"newText": {
							"startLine": 23,
							"endLine": 29,
							"context": "/** @public */\nexport type TLUiTranslationContextType = TLUiTranslation\n\n/**\n * @internal\n */\nexport const TranslationsContext = React.createContext<TLUiTranslationContextType | null>(null)"
						}
					}
				]
			},
			"thought": "I've successfully exported TranslationsContext with the @internal annotation. Now I need to update the tldraw index.ts file to export TranslationsContext, and then modify NoteShapeUtil to use useContext directly with optional chaining instead of useCurrentTranslation.",
			"timestamp": "2025-12-01T18:29:05.746Z",
			"elapsed_seconds": 221,
			"duration_seconds": 0,
			"partition": "Solution"
		},
		{
			"action": "add_thought",
			"details": {},
			"thought": "Now I need to add TranslationsContext to the exports in packages/tldraw/src/index.ts. I'll add it to the existing export statement that includes useCurrentTranslation and useTranslation.",
			"timestamp": "2025-12-01T18:29:23.882Z",
			"elapsed_seconds": 239,
			"duration_seconds": 0,
			"partition": "Solution"
		},
		{
			"action": "find_and_replace_code",
			"details": {
				"file": "packages/tldraw/src/index.ts",
				"changes": [
					{
						"originalText": {
							"startLine": 657,
							"endLine": 662,
							"context": "export {\n\tuseCurrentTranslation,\n\tuseTranslation,\n\ttype TLUiTranslationContextType,\n\ttype TLUiTranslationProviderProps,\n} from './lib/ui/hooks/useTranslation/useTranslation'"
						},
						"newText": {
							"startLine": 657,
							"endLine": 663,
							"context": "export {\n\tTranslationsContext,\n\tuseCurrentTranslation,\n\tuseTranslation,\n\ttype TLUiTranslationContextType,\n\ttype TLUiTranslationProviderProps,\n} from './lib/ui/hooks/useTranslation/useTranslation'"
						}
					}
				]
			},
			"thought": "I've successfully added TranslationsContext to the exports. Now I need to modify the NoteShapeUtil to use React.useContext(TranslationsContext) directly instead of useCurrentTranslation(), and use optional chaining when accessing translation.dir. I'll need to import React's useContext and TranslationsContext.",
			"timestamp": "2025-12-01T18:29:45.113Z",
			"elapsed_seconds": 260,
			"duration_seconds": 0,
			"partition": "Solution"
		},
		{
			"action": "add_thought",
			"details": {},
			"thought": "Now I need to modify NoteShapeUtil.tsx to replace useCurrentTranslation with useContext(TranslationsContext) and use optional chaining. I'll need to: 1) Import useContext from React, 2) Import TranslationsContext, 3) Replace the useCurrentTranslation() call with useContext(TranslationsContext), 4) Update the usage of translation.dir to translation?.dir with optional chaining in both places (line 515 and 543).",
			"timestamp": "2025-12-01T18:29:55.953Z",
			"elapsed_seconds": 271,
			"duration_seconds": 0,
			"partition": "Solution"
		},
		{
			"action": "find_and_replace_code",
			"details": {
				"file": "packages/tldraw/src/lib/shapes/note/NoteShapeUtil.tsx",
				"changes": [
					{
						"originalText": {
							"startLine": 32,
							"endLine": 36,
							"context": "\tuseValue,\n} from '@tldraw/editor'\nimport { useCallback } from 'react'\nimport { startEditingShapeWithLabel } from '../../tools/SelectTool/selectHelpers'\nimport { useCurrentTranslation } from '../../ui/hooks/useTranslation/useTranslation'"
						},
						"newText": {
							"startLine": 32,
							"endLine": 36,